{
  "DOI": "10.1007/s12687-018-0390-4",
  "ISSN": [
    "1868-310X",
    "1868-6001"
  ],
  "URL": "http://dx.doi.org/10.1007/s12687-018-0390-4",
  "alternative-id": [
    "390"
  ],
  "assertion": [
    {
      "group": {
        "label": "Article History",
        "name": "ArticleHistory"
      },
      "label": "Received",
      "name": "received",
      "order": 1,
      "value": "6 September 2018"
    },
    {
      "group": {
        "label": "Article History",
        "name": "ArticleHistory"
      },
      "label": "Accepted",
      "name": "accepted",
      "order": 2,
      "value": "11 September 2018"
    },
    {
      "group": {
        "label": "Article History",
        "name": "ArticleHistory"
      },
      "label": "First Online",
      "name": "first_online",
      "order": 3,
      "value": "19 September 2018"
    }
  ],
  "author": [
    {
      "affiliation": [],
      "family": "Modell",
      "given": "Bernadette",
      "sequence": "first"
    },
    {
      "ORCID": "http://orcid.org/0000-0002-0054-6594",
      "affiliation": [],
      "authenticated-orcid": false,
      "family": "Darlison",
      "given": "Matthew W.",
      "sequence": "additional"
    },
    {
      "affiliation": [],
      "family": "Malherbe",
      "given": "Helen",
      "sequence": "additional"
    },
    {
      "affiliation": [],
      "family": "Moorthie",
      "given": "Sowmiya",
      "sequence": "additional"
    },
    {
      "affiliation": [],
      "family": "Blencowe",
      "given": "Hannah",
      "sequence": "additional"
    },
    {
      "affiliation": [],
      "family": "Mahaini",
      "given": "Ramez",
      "sequence": "additional"
    },
    {
      "affiliation": [],
      "family": "El-Adawy",
      "given": "Maha",
      "sequence": "additional"
    }
  ],
  "container-title": [
    "Journal of Community Genetics"
  ],
  "content-domain": {
    "crossmark-restriction": false,
    "domain": [
      "link.springer.com"
    ]
  },
  "created": {
    "date-parts": [
      [
        2018,
        9,
        19
      ]
    ],
    "date-time": "2018-09-19T01:09:27Z",
    "timestamp": 1537319367000
  },
  "deposited": {
    "date-parts": [
      [
        2019,
        9,
        18
      ]
    ],
    "date-time": "2019-09-18T23:19:33Z",
    "timestamp": 1568848773000
  },
  "indexed": {
    "date-parts": [
      [
        2024,
        3,
        27
      ]
    ],
    "date-time": "2024-03-27T15:16:20Z",
    "timestamp": 1711552580149
  },
  "is-referenced-by-count": 18,
  "issn-type": [
    {
      "type": "print",
      "value": "1868-310X"
    },
    {
      "type": "electronic",
      "value": "1868-6001"
    }
  ],
  "issue": "4",
  "issued": {
    "date-parts": [
      [
        2018,
        9,
        19
      ]
    ]
  },
  "journal-issue": {
    "issue": "4",
    "published-print": {
      "date-parts": [
        [
          2018,
          10
        ]
      ]
    }
  },
  "language": "en",
  "license": [
    {
      "URL": "http://www.springer.com/tdm",
      "content-version": "tdm",
      "delay-in-days": 0,
      "start": {
        "date-parts": [
          [
            2018,
            9,
            19
          ]
        ],
        "date-time": "2018-09-19T00:00:00Z",
        "timestamp": 1537315200000
      }
    }
  ],
  "link": [
    {
      "URL": "http://link.springer.com/article/10.1007/s12687-018-0390-4/fulltext.html",
      "content-type": "text/html",
      "content-version": "vor",
      "intended-application": "text-mining"
    },
    {
      "URL": "http://link.springer.com/content/pdf/10.1007/s12687-018-0390-4.pdf",
      "content-type": "application/pdf",
      "content-version": "vor",
      "intended-application": "text-mining"
    },
    {
      "URL": "http://link.springer.com/content/pdf/10.1007/s12687-018-0390-4.pdf",
      "content-type": "application/pdf",
      "content-version": "vor",
      "intended-application": "similarity-checking"
    }
  ],
  "member": "297",
  "page": "335-340",
  "prefix": "10.1007",
  "published": {
    "date-parts": [
      [
        2018,
        9,
        19
      ]
    ]
  },
  "published-online": {
    "date-parts": [
      [
        2018,
        9,
        19
      ]
    ]
  },
  "published-print": {
    "date-parts": [
      [
        2018,
        10
      ]
    ]
  },
  "publisher": "Springer Science and Business Media LLC",
  "reference": [
    {
      "DOI": "10.1038/nrg978",
      "author": "A Alwan",
      "doi-asserted-by": "publisher",
      "first-page": "61",
      "journal-title": "Nat Rev Genet",
      "key": "390_CR1",
      "unstructured": "Alwan A, Modell B (2003) Recommendations for introducing genetics services in developing countries. Nat Rev Genet 4:61–68. \n                    https://doi.org/10.1038/nrg978",
      "volume": "4",
      "year": "2003"
    },
    {
      "key": "390_CR2",
      "unstructured": "Alwan Ad, Modell B, Bittles A, Czeizel A, Hamamy H (1997) Community control of genetic and congenital disorders. WHO EMRO technical publication, vol no 24. WHO Regional Office for the Eastern Mediterranean, Alexandria"
    },
    {
      "DOI": "10.1146/annurev.genom.5.061903.175935",
      "author": "A Christianson",
      "doi-asserted-by": "publisher",
      "first-page": "219",
      "journal-title": "Annu Rev Genomics Hum Genet",
      "key": "390_CR3",
      "unstructured": "Christianson A, Modell B (2004) Medical genetics in developing countries. Annu Rev Genomics Hum Genet 5:219–265. \n                    https://doi.org/10.1146/annurev.genom.5.061903.175935",
      "volume": "5",
      "year": "2004"
    },
    {
      "key": "390_CR4",
      "unstructured": "Christianson A, Howson C, Modell B (2006) March of Dimes: Global Report on Birth Defects, the Hidden Toll of Dying and Disabled Children. March of Dimes Birth Defects Foundation, New York"
    },
    {
      "DOI": "10.1136/bmj.306.6876.499",
      "author": "A Czeizel",
      "doi-asserted-by": "publisher",
      "first-page": "499",
      "journal-title": "Bmj",
      "key": "390_CR5",
      "unstructured": "Czeizel A, Intôdy Z, Modell B (1993) What proportion of congenital abnormalities can be prevented? Bmj 306:499–503. \n                    https://doi.org/10.1136/bmj.306.6876.499",
      "volume": "306",
      "year": "1993"
    },
    {
      "DOI": "10.1001/jamapediatrics.2016.0388",
      "author": "GL Darmstadt",
      "doi-asserted-by": "publisher",
      "first-page": "790",
      "journal-title": "JAMA Pediatr",
      "key": "390_CR6",
      "unstructured": "Darmstadt GL, Howson CP, Walraven G, Armstrong RW, Blencowe HK, Christianson AL, Kent A, Malherbe H, Murray JC, Padilla CD, Walani SR, for the Participant Working Group of the Dar es Salaam Seventh International Conference on Birth Defects and Disabilities in the Developing World (2016) Prevention of congenital disorders and care of affected children: a consensus statement. JAMA Pediatr 170:790–793. \n                    https://doi.org/10.1001/jamapediatrics.2016.0388",
      "volume": "170",
      "year": "2016"
    },
    {
      "DOI": "10.7196/samj.2016.v106i10.11314",
      "author": "L Lebese",
      "doi-asserted-by": "publisher",
      "first-page": "992",
      "journal-title": "S Afr Med J",
      "key": "390_CR7",
      "unstructured": "Lebese L, Aldous C, Malherbe H (2016) South African congenital disorders data, 2006 – 2014. S Afr Med J 106:992–995. \n                    https://doi.org/10.7196/samj.2016.v106i10.11314",
      "volume": "106",
      "year": "2016"
    },
    {
      "DOI": "10.1016/S0140-6736(12)61879-0",
      "author": "L Liu",
      "doi-asserted-by": "publisher",
      "first-page": "1556",
      "journal-title": "Lancet",
      "key": "390_CR8",
      "unstructured": "Liu L, Cousens S, Lawn JE, Black RE (2012a) Global regional and national causes of child mortality–authors’ reply. Lancet 380:1556–1557",
      "volume": "380",
      "year": "2012"
    },
    {
      "DOI": "10.1016/S0140-6736(12)60560-1",
      "author": "L Liu",
      "doi-asserted-by": "publisher",
      "first-page": "2151",
      "journal-title": "Lancet",
      "key": "390_CR9",
      "unstructured": "Liu L, Johnson HL, Cousens S, Perin J, Scott S, Lawn JE, Rudan I, Campbell H, Cibulskis R, Li M, Mathers C, Black RE (2012b) Global, regional, and national causes of child mortality: an updated systematic analysis for 2010 with time trends since 2000. Lancet 379:2151–2161. \n                    https://doi.org/10.1016/S0140-6736(12)60560-1",
      "volume": "379",
      "year": "2012"
    },
    {
      "author": "FB Livingstone",
      "key": "390_CR10",
      "unstructured": "Livingstone FB (1985) Frequencies of hemoglobin variants : thalassemia, the glucose-6-phosphate dehydrogenase deficiency, G6PD variants, and ovalocytosis in human populations. Oxford University Press, New York",
      "volume-title": "Frequencies of hemoglobin variants : thalassemia, the glucose-6-phosphate dehydrogenase deficiency, G6PD variants, and ovalocytosis in human populations",
      "year": "1985"
    },
    {
      "DOI": "10.1016/S0140-6736(12)61728-0",
      "author": "R Lozano",
      "doi-asserted-by": "publisher",
      "first-page": "2095",
      "journal-title": "Lancet",
      "key": "390_CR11",
      "unstructured": "Lozano R, Naghavi M, Foreman K, Lim S, Shibuya K, Aboyans V, Abraham J, Adair T, Aggarwal R, Ahn SY, AlMazroa MA, Alvarado M, Anderson HR, Anderson LM, Andrews KG, Atkinson C, Baddour LM, Barker-Collo S, Bartels DH, Bell ML, Benjamin EJ, Bennett D, Bhalla K, Bikbov B, Abdulhak AB, Birbeck G, Blyth F, Bolliger I, Boufous S, Bucello C, Burch M, Burney P, Carapetis J, Chen H, Chou D, Chugh SS, Coffeng LE, Colan SD, Colquhoun S, Colson KE, Condon J, Connor MD, Cooper LT, Corriere M, Cortinovis M, de Vaccaro KC, Couser W, Cowie BC, Criqui MH, Cross M, Dabhadkar KC, Dahodwala N, de Leo D, Degenhardt L, Delossantos A, Denenberg J, Des Jarlais DC, Dharmaratne SD, Dorsey ER, Driscoll T, Duber H, Ebel B, Erwin PJ, Espindola P, Ezzati M, Feigin V, Flaxman AD, Forouzanfar MH, Fowkes FGR, Franklin R, Fransen M, Freeman MK, Gabriel SE, Gakidou E, Gaspari F, Gillum RF, Gonzalez-Medina D, Halasa YA, Haring D, Harrison JE, Havmoeller R, Hay RJ, Hoen B, Hotez PJ, Hoy D, Jacobsen KH, James SL, Jasrasaria R, Jayaraman S, Johns N, Karthikeyan G, Kassebaum N, Keren A, Khoo JP, Knowlton LM, Kobusingye O, Koranteng A, Krishnamurthi R, Lipnick M, Lipshultz SE, Ohno SL, Mabweijano J, MacIntyre MF, Mallinger L, March L, Marks GB, Marks R, Matsumori A, Matzopoulos R, Mayosi BM, McAnulty JH, McDermott MM, McGrath J, Memish ZA, Mensah GA, Merriman TR, Michaud C, Miller M, Miller TR, Mock C, Mocumbi AO, Mokdad AA, Moran A, Mulholland K, Nair MN, Naldi L, Narayan KMV, Nasseri K, Norman P, O’Donnell M, Omer SB, Ortblad K, Osborne R, Ozgediz D, Pahari B, Pandian JD, Rivero AP, Padilla RP, Perez-Ruiz F, Perico N, Phillips D, Pierce K, Pope CA III, Porrini E, Pourmalek F, Raju M, Ranganathan D, Rehm JT, Rein DB, Remuzzi G, Rivara FP, Roberts T, de León FR, Rosenfeld LC, Rushton L, Sacco RL, Salomon JA, Sampson U, Sanman E, Schwebel DC, Segui-Gomez M, Shepard DS, Singh D, Singleton J, Sliwa K, Smith E, Steer A, Taylor JA, Thomas B, Tleyjeh IM, Towbin JA, Truelsen T, Undurraga EA, Venketasubramanian N, Vijayakumar L, Vos T, Wagner GR, Wang M, Wang W, Watt K, Weinstock MA, Weintraub R, Wilkinson JD, Woolf AD, Wulf S, Yeh PH, Yip P, Zabetian A, Zheng ZJ, Lopez AD, Murray CJL (2012) Global and regional mortality from 235 causes of death for 20 age groups in 1990 and 2010: a systematic analysis for the global burden of disease study 2010. Lancet 380:2095–2128. \n                    https://doi.org/10.1016/S0140-6736(12)61728-0",
      "volume": "380",
      "year": "2012"
    },
    {
      "DOI": "10.7196/samj.9136",
      "author": "H Malherbe",
      "doi-asserted-by": "publisher",
      "first-page": "186",
      "journal-title": "S Afr Med J",
      "key": "390_CR12",
      "unstructured": "Malherbe H, Christianson A, Aldous C (2015) Need for services for the care and prevention of congenital disorders in South Africa as the country’s epidemiological transition evolves. S Afr Med J 105:186–188. \n                    https://doi.org/10.7196/samj.9136",
      "volume": "105",
      "year": "2015"
    },
    {
      "DOI": "10.1016/S0140-6736(12)61878-9",
      "author": "B Modell",
      "doi-asserted-by": "publisher",
      "first-page": "1556",
      "journal-title": "Lancet",
      "key": "390_CR13",
      "unstructured": "Modell B, Berry RJ, Boyle CA, Christianson A, Darlison M, Dolk H, Howson CP, Mastroiacovo P, Mossey P, Rankin J (2012) Global regional and national causes of child mortality. Lancet 380:1556; author reply 1556–1557. \n                    https://doi.org/10.1016/S0140-6736(12)61878-9",
      "volume": "380",
      "year": "2012"
    },
    {
      "key": "390_CR14",
      "unstructured": "Modell B, Darlison MW, Moorthie S, Blencowe H, Petrou M, Lawn J (2016) Epidemiological Methods in Community Genetics and the Modell Global Database of Congenital Disorders (MGDb). \n                    http://discovery.ucl.ac.uk/1532179/"
    },
    {
      "key": "390_CR15",
      "unstructured": "Murdock GP (1967) Ethnographic atlas. Univ. of Pittsburgh, [S.l.]"
    },
    {
      "DOI": "10.1016/S0140-6736(09)61922-X",
      "author": "PW Tennant",
      "doi-asserted-by": "publisher",
      "first-page": "649",
      "journal-title": "Lancet",
      "key": "390_CR16",
      "unstructured": "Tennant PW, Pearce MS, Bythell M, Rankin J (2010) 20-year survival of children born with congenital anomalies: a population-based study. Lancet 375:649–656. \n                    https://doi.org/10.1016/S0140-6736(09)61922-X",
      "volume": "375",
      "year": "2010"
    },
    {
      "DOI": "10.1016/S0140-6736(17)32154-2",
      "author": "T Vos",
      "doi-asserted-by": "publisher",
      "first-page": "1211",
      "journal-title": "Lancet",
      "key": "390_CR17",
      "unstructured": "Vos T, Abajobir AA, Abate KH, Abbafati C, Abbas KM, Abd-Allah F, Abdulkader RS, Abdulle AM, Abebo TA, Abera SF, Aboyans V, Abu-Raddad LJ, Ackerman IN, Adamu AA, Adetokunboh O, Afarideh M, Afshin A, Agarwal SK, Aggarwal R, Agrawal A, Agrawal S, Ahmadieh H, Ahmed MB, Aichour MTE, Aichour AN, Aichour I, Aiyar S, Akinyemi RO, Akseer N, al Lami FH, Alahdab F, al-Aly Z, Alam K, Alam N, Alam T, Alasfoor D, Alene KA, Ali R, Alizadeh-Navaei R, Alkerwi A, Alla F, Allebeck P, Allen C, al-Maskari F, al-Raddadi R, Alsharif U, Alsowaidi S, Altirkawi KA, Amare AT, Amini E, Ammar W, Amoako YA, Andersen HH, Antonio CAT, Anwari P, Ärnlöv J, Artaman A, Aryal KK, Asayesh H, Asgedom SW, Assadi R, Atey TM, Atnafu NT, Atre SR, Avila-Burgos L, Avokphako EFGA, Awasthi A, Bacha U, Badawi A, Balakrishnan K, Banerjee A, Bannick MS, Barac A, Barber RM, Barker-Collo SL, Bärnighausen T, Barquera S, Barregard L, Barrero LH, Basu S, Battista B, Battle KE, Baune BT, Bazargan-Hejazi S, Beardsley J, Bedi N, Beghi E, Béjot Y, Bekele BB, Bell ML, Bennett DA, Bensenor IM, Benson J, Berhane A, Berhe DF, Bernabé E, Betsu BD, Beuran M, Beyene AS, Bhala N, Bhansali A, Bhatt S, Bhutta ZA, Biadgilign S, Bicer BK, Bienhoff K, Bikbov B, Birungi C, Biryukov S, Bisanzio D, Bizuayehu HM, Boneya DJ, Boufous S, Bourne RRA, Brazinova A, Brugha TS, Buchbinder R, Bulto LNB, Bumgarner BR, Butt ZA, Cahuana-Hurtado L, Cameron E, Car M, Carabin H, Carapetis JR, Cárdenas R, Carpenter DO, Carrero JJ, Carter A, Carvalho F, Casey DC, Caso V, Castañeda-Orjuela CA, Castle CD, Catalá-López F, Chang HY, Chang JC, Charlson FJ, Chen H, Chibalabala M, Chibueze CE, Chisumpa VH, Chitheer AA, Christopher DJ, Ciobanu LG, Cirillo M, Colombara D, Cooper C, Cortesi PA, Criqui MH, Crump JA, Dadi AF, Dalal K, Dandona L, Dandona R, das Neves J, Davitoiu DV, de Courten B, de Leo DD, Defo BK, Degenhardt L, Deiparine S, Dellavalle RP, Deribe K, Des Jarlais DC, Dey S, Dharmaratne SD, Dhillon PK, Dicker D, Ding EL, Djalalinia S, Do HP, Dorsey ER, dos Santos KPB, Douwes-Schultz D, Doyle KE, Driscoll TR, Dubey M, Duncan BB, el-Khatib ZZ, Ellerstrand J, Enayati A, Endries AY, Ermakov SP, Erskine HE, Eshrati B, Eskandarieh S, Esteghamati A, Estep K, Fanuel FBB, Farinha CSES, Faro A, Farzadfar F, Fazeli MS, Feigin VL, Fereshtehnejad SM, Fernandes JC, Ferrari AJ, Feyissa TR, Filip I, Fischer F, Fitzmaurice C, Flaxman AD, Flor LS, Foigt N, Foreman KJ, Franklin RC, Fullman N, Fürst T, Furtado JM, Futran ND, Gakidou E, Ganji M, Garcia-Basteiro AL, Gebre T, Gebrehiwot TT, Geleto A, Gemechu BL, Gesesew HA, Gething PW, Ghajar A, Gibney KB, Gill PS, Gillum RF, Ginawi IAM, Giref AZ, Gishu MD, Giussani G, Godwin WW, Gold AL, Goldberg EM, Gona PN, Goodridge A, Gopalani SV, Goto A, Goulart AC, Griswold M, Gugnani HC, Gupta R, Gupta R, Gupta T, Gupta V, Hafezi-Nejad N, Hailu GB, Hailu AD, Hamadeh RR, Hamidi S, Handal AJ, Hankey GJ, Hanson SW, Hao Y, Harb HL, Hareri HA, Haro JM, Harvey J, Hassanvand MS, Havmoeller R, Hawley C, Hay SI, Hay RJ, Henry NJ, Heredia-Pi IB, Hernandez JM, Heydarpour P, Hoek HW, Hoffman HJ, Horita N, Hosgood HD, Hostiuc S, Hotez PJ, Hoy DG, Htet AS, Hu G, Huang H, Huynh C, Iburg KM, Igumbor EU, Ikeda C, Irvine CMS, Jacobsen KH, Jahanmehr N, Jakovljevic MB, Jassal SK, Javanbakht M, Jayaraman SP, Jeemon P, Jensen PN, Jha V, Jiang G, John D, Johnson SC, Johnson CO, Jonas JB, Jürisson M, Kabir Z, Kadel R, Kahsay A, Kamal R, Kan H, Karam NE, Karch A, Karema CK, Kasaeian A, Kassa GM, Kassaw NA, Kassebaum NJ, Kastor A, Katikireddi SV, Kaul A, Kawakami N, Keiyoro PN, Kengne AP, Keren A, Khader YS, Khalil IA, Khan EA, Khang YH, Khosravi A, Khubchandani J, Kiadaliri AA, Kieling C, Kim YJ, Kim D, Kim P, Kimokoti RW, Kinfu Y, Kisa A, Kissimova-Skarbek KA, Kivimaki M, Knudsen AK, Kokubo Y, Kolte D, Kopec JA, Kosen S, Koul PA, Koyanagi A, Kravchenko M, Krishnaswami S, Krohn KJ, Kumar GA, Kumar P, Kumar S, Kyu HH, Lal DK, Lalloo R, Lambert N, Lan Q, Larsson A, Lavados PM, Leasher JL, Lee PH, Lee JT, Leigh J, Leshargie CT, Leung J, Leung R, Levi M, Li Y, Li Y, Li Kappe D, Liang X, Liben ML, Lim SS, Linn S, Liu PY, Liu A, Liu S, Liu Y, Lodha R, Logroscino G, London SJ, Looker KJ, Lopez AD, Lorkowski S, Lotufo PA, Low N, Lozano R, Lucas TCD, Macarayan ERK, Magdy Abd el Razek H, Magdy Abd el Razek M, Mahdavi M, Majdan M, Majdzadeh R, Majeed A, Malekzadeh R, Malhotra R, Malta DC, Mamun AA, Manguerra H, Manhertz T, Mantilla A, Mantovani LG, Mapoma CC, Marczak LB, Martinez-Raga J, Martins-Melo FR, Martopullo I, März W, Mathur MR, Mazidi M, McAlinden C, McGaughey M, McGrath JJ, McKee M, McNellan C, Mehata S, Mehndiratta MM, Mekonnen TC, Memiah P, Memish ZA, Mendoza W, Mengistie MA, Mengistu DT, Mensah GA, Meretoja TJ, Meretoja A, Mezgebe HB, Micha R, Millear A, Miller TR, Mills EJ, Mirarefin M, Mirrakhimov EM, Misganaw A, Mishra SR, Mitchell PB, Mohammad KA, Mohammadi A, Mohammed KE, Mohammed S, Mohanty SK, Mokdad AH, Mollenkopf SK, Monasta L, Montico M, Moradi-Lakeh M, Moraga P, Mori R, Morozoff C, Morrison SD, Moses M, Mountjoy-Venning C, Mruts KB, Mueller UO, Muller K, Murdoch ME, Murthy GVS, Musa KI, Nachega JB, Nagel G, Naghavi M, Naheed A, Naidoo KS, Naldi L, Nangia V, Natarajan G, Negasa DE, Negoi RI, Negoi I, Newton CR, Ngunjiri JW, Nguyen TH, Nguyen QL, Nguyen CT, Nguyen G, Nguyen M, Nichols E, Ningrum DNA, Nolte S, Nong VM, Norrving B, Noubiap JJN, O’Donnell MJ, Ogbo FA, Oh IH, Okoro A, Oladimeji O, Olagunju TO, Olagunju AT, Olsen HE, Olusanya BO, Olusanya JO, Ong K, Opio JN, Oren E, Ortiz A, Osgood-Zimmerman A, Osman M, Owolabi MO, PA M, Pacella RE, Pana A, Panda BK, Papachristou C, Park EK, Parry CD, Parsaeian M, Patten SB, Patton GC, Paulson K, Pearce N, Pereira DM, Perico N, Pesudovs K, Peterson CB, Petzold M, Phillips MR, Pigott DM, Pillay JD, Pinho C, Plass D, Pletcher MA, Popova S, Poulton RG, Pourmalek F, Prabhakaran D, Prasad NM, Prasad N, Purcell C, Qorbani M, Quansah R, Quintanilla BPA, Rabiee RHS, Radfar A, Rafay A, Rahimi K, Rahimi-Movaghar A, Rahimi-Movaghar V, Rahman MHU, Rahman M, Rai RK, Rajsic S, Ram U, Ranabhat CL, Rankin Z, Rao PC, Rao PV, Rawaf S, Ray SE, Reiner RC, Reinig N, Reitsma MB, Remuzzi G, Renzaho AMN, Resnikoff S, Rezaei S, Ribeiro AL, Ronfani L, Roshandel G, Roth GA, Roy A, Rubagotti E, Ruhago GM, Saadat S, Sadat N, Safdarian M, Safi S, Safiri S, Sagar R, Sahathevan R, Salama J, Saleem HOB, Salomon JA, Salvi SS, Samy AM, Sanabria JR, Santomauro D, Santos IS, Santos JV, Santric Milicevic MM, Sartorius B, Satpathy M, Sawhney M, Saxena S, Schmidt MI, Schneider IJC, Schöttker B, Schwebel DC, Schwendicke F, Seedat S, Sepanlou SG, Servan-Mori EE, Setegn T, Shackelford KA, Shaheen A, Shaikh MA, Shamsipour M, Shariful Islam SM, Sharma J, Sharma R, She J, Shi P, Shields C, Shifa GT, Shigematsu M, Shinohara Y, Shiri R, Shirkoohi R, Shirude S, Shishani K, Shrime MG, Sibai AM, Sigfusdottir ID, Silva DAS, Silva JP, Silveira DGA, Singh JA, Singh NP, Sinha DN, Skiadaresi E, Skirbekk V, Slepak EL, Sligar A, Smith DL, Smith M, Sobaih BHA, Sobngwi E, Sorensen RJD, Sousa TCM, Sposato LA, Sreeramareddy CT, Srinivasan V, Stanaway JD, Stathopoulou V, Steel N, Stein MB, Stein DJ, Steiner TJ, Steiner C, Steinke S, Stokes MA, Stovner LJ, Strub B, Subart M, Sufiyan MB, Sunguya BF, Sur PJ, Swaminathan S, Sykes BL, Sylte DO, Tabarés-Seisdedos R, Taffere GR, Takala JS, Tandon N, Tavakkoli M, Taveira N, Taylor HR, Tehrani-Banihashemi A, Tekelab T, Terkawi AS, Tesfaye DJ, Tesssema B, Thamsuwan O, Thomas KE, Thrift AG, Tiruye TY, Tobe-Gai R, Tollanes MC, Tonelli M, Topor-Madry R, Tortajada M, Touvier M, Tran BX, Tripathi S, Troeger C, Truelsen T, Tsoi D, Tuem KB, Tuzcu EM, Tyrovolas S, Ukwaja KN, Undurraga EA, Uneke CJ, Updike R, Uthman OA, Uzochukwu BSC, van Boven JFM, Varughese S, Vasankari T, Venkatesh S, Venketasubramanian N, Vidavalur R, Violante FS, Vladimirov SK, Vlassov VV, Vollset SE, Wadilo F, Wakayo T, Wang YP, Weaver M, Weichenthal S, Weiderpass E, Weintraub RG, Werdecker A, Westerman R, Whiteford HA, Wijeratne T, Wiysonge CS, Wolfe CDA, Woodbrook R, Woolf AD, Workicho A, Xavier D, Xu G, Yadgir S, Yaghoubi M, Yakob B, Yan LL, Yano Y, Ye P, Yimam HH, Yip P, Yonemoto N, Yoon SJ, Yotebieng M, Younis MZ, Zaidi Z, Zaki MES, Zegeye EA, Zenebe ZM, Zhang X, Zhou M, Zipkin B, Zodpey S, Zuhlke LJ, Murray CJL (2017) Global, regional, and national incidence, prevalence, and years lived with disability for 328 diseases and injuries for 195 countries, 1990-2016: a systematic analysis for the Global Burden of Disease Study 2016. Lancet 390:1211–1259. \n                    https://doi.org/10.1016/S0140-6736(17)32154-2",
      "volume": "390",
      "year": "2017"
    },
    {
      "author": "D Wittenburg",
      "edition": "6",
      "key": "390_CR18",
      "unstructured": "Wittenburg D (2009) Coovadia’s paediatrics and child health: a manual for health professionals in developing countries, 6th edn. Oxford University Press Southern Africa, Cape Town",
      "volume-title": "Coovadia’s paediatrics and child health: a manual for health professionals in developing countries",
      "year": "2009"
    },
    {
      "key": "390_CR19",
      "unstructured": "World Health Assembly (2010) Sixty-Third World Health Assembly - Resolution 63.17. Birth Defects vol 2014. World Health Organization"
    },
    {
      "key": "390_CR20",
      "unstructured": "World Health Organization (1992) International Statistical Classification of Diseases and Related Health Problems. 10th revision. World Health Organization, Geneva"
    },
    {
      "key": "390_CR21",
      "unstructured": "World Health Organization (1996) Control of hereditary diseases: report of a WHO scientific group 1993, Geneva, Switzerland. World Health Organization, Geneva"
    },
    {
      "key": "390_CR22",
      "unstructured": "World Health Organization (1999) Services for the Prevention and Management of Genetic Disorders and Birth Defects in Developing Countries. Report of a Joint WHO/WAOPBD Meeting, The Hague, 5-7 January 1999. World Health Organization, Geneva"
    },
    {
      "key": "390_CR23",
      "unstructured": "World Health Organization (2000) Primary health care approaches for prevention and control of congenital and genetic disorders : report of a WHO meeting, Cairo, Egypt, 6-8 December 1999. World Health Organization, Geneva"
    },
    {
      "key": "390_CR24",
      "unstructured": "World Health Organization (2005) Community approaches to the control of hereditary diseases. Report of a WHO Advisory Group, Geneva, 3-5 October 1985. World Health Organization, Geneva"
    },
    {
      "key": "390_CR25",
      "unstructured": "World Health Organization (2006) Management of Birth Defects and Haemoglobin Disorders. Report of a Joint who-March of Dimes Meeting. Geneva, Switzerland, 17-19 May 2006. World Health Organization, Geneva"
    },
    {
      "key": "390_CR26",
      "unstructured": "World Health Organization (2015) Summary report on the Meeting on promoting preconception care in the Eastern Mediterranean Region, Muscat, Oman 25–27 March 2015"
    },
    {
      "key": "390_CR27",
      "unstructured": "World Health Organization ROfS-EA (2013) Prevention and control of birth defects in South-East Asia Region: strategic framework (2013–2017)"
    }
  ],
  "reference-count": 27,
  "references-count": 27,
  "resource": {
    "primary": {
      "URL": "http://link.springer.com/10.1007/s12687-018-0390-4"
    }
  },
  "score": 0,
  "short-container-title": [
    "J Community Genet"
  ],
  "source": "Crossref",
  "title": [
    "Congenital disorders: epidemiological methods for answering calls for action"
  ],
  "type": "journal-article",
  "update-policy": "http://dx.doi.org/10.1007/springer_crossmark_policy",
  "volume": "9"
}